,時間,店名,ジャンル,予約・お問い合わせ,予約可否,住所,交通手段,営業時間,定休日,予算,予算（口コミ集計）,支払い方法,サービス料・チャージ,席数,個室,貸切,禁煙・喫煙,駐車場,空間・設備,携帯電話
0,2018-10-20 19:31:54.594328,海鮮丼の浦島,海鮮丼、魚介料理・海鮮料理、居酒屋,050-5890-8174,予約可,北海道札幌市中央区南4条西4-1 ススキノラフィラ B2F 大きな地図を見る 周辺のお店を探す,札幌市営地下鉄南北線 すすきの駅直結　5番出口札幌ドームへお越しの際は地下鉄東豊線すすきの駅↔福住駅9分ラフィラから東豊線すすきの駅まで徒歩5分 すすきの駅（市電）から55m,10:00～21:00　（L.O.20:00）テイクアウトは20:30迄お受けいたします。 日曜営業,無休　（１月１日のみ休日）,"[夜]￥3,000～￥3,999 [昼]￥3,000～￥3,999","[昼]￥4,000～￥4,999 予算分布を見る",カード可  （VISA、MASTER、JCB、AMEX、Diners）  電子マネー不可,サービス料・チャージ料・お通し代等は一切ありません。,16席  （全てテーブル）,無,不可,完全禁煙  B1Fに喫煙所あり,"有  ラフィラ駐車場をご利用下さい！　ラフィラ館内店舗にて2,000円以上お買い上げで２時間無料！",バリアフリー,docomo、au、SoftBank、Y!mobile
1,2018-10-20 19:31:56.055147,炭焼きイタリアン酒場 炭リッチ 総本店,居酒屋、イタリアン、パスタ,050-5595-1067,予約可 時間帯によって、お電話が繋がりにくい場合がございます。その際はネットからのご予約をお願い致します。,北海道札幌市中央区南一条西6丁目1-4 第27桂和ビル 2F  このお店は「札幌市中央区南1条西7-11-1」から移転しています。  ※移転前の情報は最新のものとは異なります。  移転前の店舗情報を見る 大きな地図を見る 周辺のお店を探す,大通駅から徒歩2分!!南１条市電通り沿い。東急ハンズ隣。モスバーガーさんがあるビルの２階です。 西８丁目駅から245m,平日ランチ　11時半～15時平日ディナー16時半～24時土日祝ランチ　11時半～15時土日祝ディナー16時半～24時 日曜営業,年中無休,"[夜]￥2,000～￥2,999 [昼] ～￥999","[夜]￥2,000～￥2,999 [昼]￥1,000～￥1,999 予算分布を見る",カード可  （VISA、MASTER、JCB、AMEX）  電子マネー不可,,60席  （半個室5席！最大宴会30名様！）,有 カーテンで仕切りのある半個室です。,不可,全面喫煙可,無,オシャレな空間、落ち着いた空間、席が広い、カップルシートあり、カウンター席あり、無料Wi-Fiあり,docomo、au、SoftBank、Y!mobile
2,2018-10-20 19:31:56.598772,Natural&Organic アリスの庭,ダイニングバー、イタリアン、ステーキ,050-5595-8664,予約可,北海道札幌市中央区北3条西2-8 さっけんビル 1F 大きな地図を見る 周辺のお店を探す,札幌駅から徒歩3分。21番出口から出ますと徒歩1分以内で到着します。東急百貨店からは徒歩2分。 さっぽろ駅（札幌市営）から266m,11:00～15:00(L.O.) 17:00～23:00(L.O.22:30),無休(10月15日より月曜日を定休とさせて頂きます。),"[夜]￥4,000～￥4,999 [昼]￥1,000～￥1,999","[夜]￥6,000～￥7,999 [昼]￥1,000～￥1,999 予算分布を見る",カード可  （VISA、MASTER、JCB、AMEX）  電子マネー不可,,28席,無,可 （20人～50人可）,完全禁煙,無,オシャレな空間、落ち着いた空間,docomo、au、SoftBank、Y!mobile
3,2018-10-20 19:31:57.944554,すすきのジンギスカン 5条店,ジンギスカン、しゃぶしゃぶ、焼肉,050-5595-2050,予約可,北海道札幌市中央区南5条西6 第3エイトビル 2F 大きな地図を見る 周辺のお店を探す,地下鉄南北線すすきの駅 徒歩5分札幌市電「資生館小学校前」 徒歩2分じょうてつバス(南55)「資生館小学校前」 徒歩3分 資生館小学校前駅から114m,[月曜~土曜]17:00～翌6:00 （料理L.O. 翌5:30 ドリンクL.O. 翌5:30）[日曜・祝日] 17:00～翌3:00 （料理L.O. 翌2:30 ドリンクL.O. 翌2:30） 日曜営業,無休,"[夜]￥2,000～￥2,999","[夜]￥3,000～￥3,999 予算分布を見る",カード可  （VISA、MASTER、JCB、AMEX、Diners）  電子マネー不可,,55席,無,可 （50人以上可）,全面喫煙可,無,落ち着いた空間、席が広い、カウンター席あり、座敷あり、掘りごたつあり,docomo、au、SoftBank、Y!mobile
4,2018-10-20 19:31:59.337250,夜景ダイニング maruhan  （まるはん）,居酒屋、魚介料理・海鮮料理、カフェ,050-5890-1710,予約可,北海道札幌市中央区南五条西2 美松村岡ビル　９Ｆ 大きな地図を見る 周辺のお店を探す,地下鉄南北線すすきの駅徒歩4分／地下鉄東豊線豊水すすきの駅徒歩1分 豊水すすきの駅から20m,通常17:00～翌12:30金・土17:00～翌1:00祝日17:00～翌0:00,月曜日,"[夜]￥3,000～￥3,999","[夜]￥3,000～￥3,999 予算分布を見る",カード可  （VISA、MASTER、JCB、AMEX）  電子マネー不可,お通し380円,60席,有 （2人可、4人可、6人可、8人可、10～20人可、20～30人可、30人以上可）,不可,全面喫煙可,有  近隣に有料コインパーキング有り,オシャレな空間、落ち着いた空間、席が広い、カップルシートあり、ソファー席あり、掘りごたつあり,docomo、au、SoftBank、Y!mobile
